,img_url,caption,n_likes_1000,n_comments,age
418,https://scontent-waw1-1.cdninstagram.com/v/t51.2885-15/sh0.08/e35/s640x640/12976532_940231576074031_989010995_n.jpg?_nc_ht=scontent-waw1-1.cdninstagram.com&_nc_cat=107&_nc_ohc=3WNY0KJQ7LsAX_eQKOA&edm=APU89FABAAAA&ccb=7-4&oh=748213a905a49ebf7d6deb5ef4c697cc&oe=615CC431&_nc_sid=86f79a,"Fit for a Queen.
#SpeedTakes innovation. Introducing the new @TeamGB Kit. #100DaysToGo",95k,201,5 years ago
419,https://scontent-waw1-1.cdninstagram.com/v/t51.2885-15/sh0.08/e35/s640x640/13108938_1007920405929505_700118639_n.jpg?_nc_ht=scontent-waw1-1.cdninstagram.com&_nc_cat=101&_nc_ohc=levmpWgyOrIAX8W-Aun&edm=APU89FABAAAA&ccb=7-4&oh=f71cef88422537c155b664a0cb7bcf31&oe=615D448A&_nc_sid=86f79a,"Boss everyone. Create history.
@Juventus: 2015/16 champions. 🏆",90k,197,5 years ago
420,https://scontent-waw1-1.cdninstagram.com/v/t51.2885-15/sh0.08/e35/s640x640/12935107_630088863808282_1431840401_n.jpg?_nc_ht=scontent-waw1-1.cdninstagram.com&_nc_cat=110&_nc_ohc=Nx3yM94mENkAX_cLlD4&edm=APU89FABAAAA&ccb=7-4&oh=dd27fdf4db9518c33fd360a9f8f696b9&oe=615C8F69&_nc_sid=86f79a,"Line up, London. Today we run this city.",101k,426,5 years ago
421,https://scontent-waw1-1.cdninstagram.com/v/t51.2885-15/sh0.08/e35/s640x640/12918499_1202823199730607_1409051203_n.jpg?_nc_ht=scontent-waw1-1.cdninstagram.com&_nc_cat=103&_nc_ohc=ZTeo5UxHVgYAX_E2SSr&edm=APU89FABAAAA&ccb=7-4&oh=e2d2a0c7fe4965d4bb79881fe328bf37&oe=615C2BFC&_nc_sid=86f79a,"The greatest footprint we can have is not having one at all. To celebrate Earth Day, we are proud to announce that plastic shopping bags in our retail stores are now history.",91k,433,5 years ago
422,https://scontent-waw1-1.cdninstagram.com/v/t51.2885-15/sh0.08/e35/p640x640/12960038_1588796431434632_8954719_n.jpg?_nc_ht=scontent-waw1-1.cdninstagram.com&_nc_cat=108&_nc_ohc=62efYiHITiMAX_q2pYf&edm=APU89FABAAAA&ccb=7-4&oh=d1523ac2e24505f37b7300164e52c1ea&oe=615D7313&_nc_sid=86f79a,"Hayle to the king. Today, Lemi Berhanu Hayle rules Boston. 🏁🏆",63k,272,5 years ago
423,https://scontent-waw1-1.cdninstagram.com/v/t51.2885-15/sh0.08/e35/s640x640/12976277_1711472059107902_2028156345_n.jpg?_nc_ht=scontent-waw1-1.cdninstagram.com&_nc_cat=102&_nc_ohc=i2RNLZXGZi0AX8UStkt&edm=APU89FABAAAA&ccb=7-4&oh=b6a8841010253120041cfaeccd4142a9&oe=615E00B2&_nc_sid=86f79a,They told @MoeBrian she was too small to play. They were wrong. Bigger doesn’t always mean better. #SpeedTakes creativity.,73k,184,5 years ago
424,https://scontent-waw1-1.cdninstagram.com/v/t51.2885-15/sh0.08/e35/s640x640/12599386_1586859758298493_1722296701_n.jpg?_nc_ht=scontent-waw1-1.cdninstagram.com&_nc_cat=101&_nc_ohc=UsSHvLlMqYQAX9ZWBSu&edm=APU89FABAAAA&ccb=7-4&oh=b75c18349c098f893c551ca40a30d3a8&oe=615C6D2D&_nc_sid=86f79a,"Sport runs deep for @TylaNathanWong. It’s in her genes. But without support, she wouldn’t be ready to take on the world. #SpeedTakes family.",75k,290,5 years ago
425,https://scontent-waw1-1.cdninstagram.com/v/t51.2885-15/sh0.08/e35/s640x640/12917850_1095417910532402_1635563853_n.jpg?_nc_ht=scontent-waw1-1.cdninstagram.com&_nc_cat=102&_nc_ohc=xfp-ekLZkkwAX_aqCHO&edm=APU89FABAAAA&ccb=7-4&oh=304550be9c515ce4f3b50e97e3dfaed8&oe=615CBEDC&_nc_sid=86f79a,Spit out fire. Sweat out weakness. Climachill will guide you through the flames.,68k,113,5 years ago
426,https://scontent-waw1-1.cdninstagram.com/v/t51.2885-15/sh0.08/e35/s640x640/11417440_1584956645156178_91456022_n.jpg?_nc_ht=scontent-waw1-1.cdninstagram.com&_nc_cat=106&_nc_ohc=BxKOZpHBaOIAX9qdCOd&edm=APU89FABAAAA&ccb=7-4&oh=ed1bef7a3e8a301028333cbc4650423c&oe=615D8D74&_nc_sid=86f79a,Create your mark. Earn your stripes. @anaivanovic introduces the new @adidasTennis Roland Garros collection by @adidasY3.,84k,196,5 years ago
427,https://scontent-waw1-1.cdninstagram.com/v/t51.2885-15/sh0.08/e35/p640x640/12445770_799879913481571_1582458844_n.jpg?_nc_ht=scontent-waw1-1.cdninstagram.com&_nc_cat=107&_nc_ohc=Zemg5tUu-MoAX8rljzp&edm=APU89FABAAAA&ccb=7-4&oh=b0bd3c6378cadcee79113e20c7d5267a&oe=615C33B0&_nc_sid=86f79a,"@GarbiMuguruza trains to be as dangerous as she can be. Practice makes perfect, but risks win titles. Believe you can win and trust your judgement. #SpeedTakes instinct.",64k,231,5 years ago
428,https://scontent-waw1-1.cdninstagram.com/v/t51.2885-15/sh0.08/e35/s640x640/12479057_787042131430848_1606240342_n.jpg?_nc_ht=scontent-waw1-1.cdninstagram.com&_nc_cat=100&_nc_ohc=G8x_8sE5fsQAX_dpNzc&edm=APU89FABAAAA&ccb=7-4&oh=dce1c50f80e33ddf6590f54b175510c0&oe=615C377F&_nc_sid=86f79a,@DeGoedeEva has played for her country since she was 17. But never on her own. #SpeedTakes teamwork.,63k,203,5 years ago
429,https://scontent-waw1-1.cdninstagram.com/v/t51.2885-15/sh0.08/e35/s640x640/10817981_1221334154560966_1055397583_n.jpg?_nc_ht=scontent-waw1-1.cdninstagram.com&_nc_cat=110&_nc_ohc=wkHvKUdLKR8AX8156xh&edm=APU89FABAAAA&ccb=7-4&oh=794d2e9012fa1ae9bcb66ccc67fae28f&oe=615CE82E&_nc_sid=86f79a,"When barriers stand in the way, creators rise above.",79k,89,5 years ago
430,https://scontent-waw1-1.cdninstagram.com/v/t51.2885-15/sh0.08/e35/s640x640/12328023_1002413413169798_1216158597_n.jpg?_nc_ht=scontent-waw1-1.cdninstagram.com&_nc_cat=102&_nc_ohc=4hr98B-HtCsAX8f-yAI&edm=APU89FABAAAA&ccb=7-4&oh=1c89b35588dedf814331caef1f1e1a35&oe=615D0642&_nc_sid=86f79a,Some run for shelter. Creators charge through. Launch into the heat with Climachill.,80k,153,5 years ago
431,https://scontent-waw1-1.cdninstagram.com/v/t51.2885-15/sh0.08/e35/s640x640/10401629_531462460367889_711422069_n.jpg?_nc_ht=scontent-waw1-1.cdninstagram.com&_nc_cat=109&_nc_ohc=ZwZCtJylWR4AX-ar6R_&edm=APU89FABAAAA&ccb=7-4&oh=4433c6791f6dbc33ec0646b5c40a628f&oe=615D0741&_nc_sid=86f79a,Invest in your future with the lightest cleat in football. Introducing the adizero 5-Star 5.0 x Kevlar by @SnoopDogg.,124k,1892,5 years ago
432,https://scontent-waw1-1.cdninstagram.com/v/t51.2885-15/sh0.08/e35/s640x640/10499042_949905325106276_498592640_n.jpg?_nc_ht=scontent-waw1-1.cdninstagram.com&_nc_cat=108&_nc_ohc=2AvlulZqgI4AX9NY0Tv&edm=APU89FABAAAA&ccb=7-4&oh=72828008f80db3a06252a1faa8fec598&oe=615D1D24&_nc_sid=86f79a,"&quot;I chose adidas because we have shared passions and values. They have the same vibe I do, on and off the pitch. My biggest passion is football and I needed a brand that would give me the space to express myself and explore new frontiers.&quot; Creators x adidas. Welcome to the family, @PaulPogba.",83k,402,5 years ago
433,https://scontent-waw1-1.cdninstagram.com/v/t51.2885-15/sh0.08/e35/s640x640/12825856_786014254862210_392463465_n.jpg?_nc_ht=scontent-waw1-1.cdninstagram.com&_nc_cat=102&_nc_ohc=-UwYrbOBf2sAX_MKXiW&edm=APU89FABAAAA&ccb=7-4&oh=cd6b40c4fbfa63b0c0dd9bed0d29ee2a&oe=615C8210&_nc_sid=86f79a,Raise the bar and fly high.,70k,120,5 years ago
434,https://scontent-waw1-1.cdninstagram.com/v/t51.2885-15/sh0.08/e35/p640x640/12797800_1721544518083556_13455283_n.jpg?_nc_ht=scontent-waw1-1.cdninstagram.com&_nc_cat=108&_nc_ohc=BVX4eF5rwxgAX-w9C83&edm=APU89FABAAAA&ccb=7-4&oh=70159835d37b4f3d322e3730ba3e64cd&oe=615CEEC5&_nc_sid=86f79a,"Create the future youve always imagined. Put your best foot forward with the NMD City Sock, dropping worldwide March 17th (early May in the U.S.).",72k,393,5 years ago
435,https://scontent-waw1-1.cdninstagram.com/v/t51.2885-15/sh0.08/e35/s640x640/915547_1305029512846014_629127786_n.jpg?_nc_ht=scontent-waw1-1.cdninstagram.com&_nc_cat=106&_nc_ohc=2ffwrq7GCJ0AX8QvaM6&edm=APU89FABAAAA&ccb=7-4&oh=74c3d16eb10cb2bd7640991bd6ab2e6d&oe=615CE4CE&_nc_sid=86f79a,"When extraordinary is your ordinary, its worth celebrating.

On #InternationalWomensDay, get creative with @adidasWomen.

1. Post a pic/video/gif of you/your crew – smashing PR’s, mixing up routines, taking training to unexpected places.
2. Tag @adidasWomen #heretocreate

Well choose the best creators and share them right here.",86k,276,5 years ago
436,https://scontent-waw1-1.cdninstagram.com/v/t51.2885-15/sh0.08/e35/s640x640/12797878_591370234354956_1882031303_n.jpg?_nc_ht=scontent-waw1-1.cdninstagram.com&_nc_cat=100&_nc_ohc=aHddkxvgDg8AX_yWREk&edm=APU89FABAAAA&ccb=7-4&oh=63104020a2b4f349f7854d12302333fc&oe=615CB8AA&_nc_sid=86f79a,Unwavering focus. Tireless training. Lap after lap. This path leads to gold.,74k,107,5 years ago
437,https://scontent-waw1-1.cdninstagram.com/v/t51.2885-15/sh0.08/e35/s640x640/12784012_1563072674004128_1082061279_n.jpg?_nc_ht=scontent-waw1-1.cdninstagram.com&_nc_cat=108&_nc_ohc=UjlTV-8GgVEAX9KPLqK&edm=APU89FABAAAA&ccb=7-4&oh=597be9fd480682259e5c9fb266934834&oe=615CCFDA&_nc_sid=86f79a,The Queen of the track. @laura_trott31 is double World Track Champion. 🏅🏅,79k,219,5 years ago
438,https://scontent-waw1-1.cdninstagram.com/v/t51.2885-15/sh0.08/e35/s640x640/12783178_1710959902514945_787195474_n.jpg?_nc_ht=scontent-waw1-1.cdninstagram.com&_nc_cat=105&_nc_ohc=XZqh2aMcQMgAX-MzNnJ&edm=APU89FABAAAA&ccb=7-4&oh=c2e0526ae59a3f8566f13aa85864aab4&oe=615C4177&_nc_sid=86f79a,"Capturing the finest creators in skateboarding.
Away Days - A full-length skateboard film. Coming soon.",71k,124,5 years ago
439,https://scontent-waw1-1.cdninstagram.com/v/t51.2885-15/sh0.08/e35/s640x640/12725098_1701617056786254_989820060_n.jpg?_nc_ht=scontent-waw1-1.cdninstagram.com&_nc_cat=106&_nc_ohc=P69d3sZAPucAX9eF0sn&edm=APU89FABAAAA&ccb=7-4&oh=213870f0152d38bf428b2692f36b5521&oe=615C5FF5&_nc_sid=86f79a,"Challenge yourself one pose after another.
Inner balance creates outer strength.",68k,130,5 years ago
440,https://scontent-waw1-1.cdninstagram.com/v/t51.2885-15/sh0.08/e35/s640x640/12748199_1832738080286689_269147846_n.jpg?_nc_ht=scontent-waw1-1.cdninstagram.com&_nc_cat=101&_nc_ohc=_BKOPBptMwsAX_XUMnG&edm=APU89FABAAAA&ccb=7-4&oh=de2f395b59891bac3c547e7fc3cd18e0&oe=615CAD65&_nc_sid=86f79a,Youll never know your limits until you put them to the test. Create a path to the peak and never stop reaching.,89k,160,5 years ago
441,https://scontent-waw1-1.cdninstagram.com/v/t51.2885-15/sh0.08/e35/s640x640/12725138_179938859049081_925445195_n.jpg?_nc_ht=scontent-waw1-1.cdninstagram.com&_nc_cat=109&_nc_ohc=v7SxQ3eBjfYAX8QyO27&edm=APU89FABAAAA&ccb=7-4&oh=0b11cb7a1130ae9f2e408caa7bf43de8&oe=615DEFFE&_nc_sid=86f79a,Reach the top for a better view of your next challenge. @JodieAlicia is ready to create.,84k,163,5 years ago
442,https://scontent-waw1-1.cdninstagram.com/v/t51.2885-15/sh0.08/e35/s640x640/12716977_1714241702151455_138129618_n.jpg?_nc_ht=scontent-waw1-1.cdninstagram.com&_nc_cat=111&_nc_ohc=qGp2x0ASJ3oAX8R_j60&edm=APU89FABAAAA&ccb=7-4&oh=e173f8a60c1c85d244cc5b75dd22a04a&oe=615DEF63&_nc_sid=86f79a,"Helping you find your true north. Guiding you to create your best self.
adidas x Wanderlust",67k,114,5 years ago
443,https://scontent-waw1-1.cdninstagram.com/v/t51.2885-15/sh0.08/e35/s640x640/12729638_787792621350633_1808690259_n.jpg?_nc_ht=scontent-waw1-1.cdninstagram.com&_nc_cat=109&_nc_ohc=ckNqfgdmfogAX8_UZ1D&edm=APU89FABAAAA&ccb=7-4&oh=5a4519ceca85bc9523497279cb6a7e11&oe=615DF073&_nc_sid=86f79a,Creativity takes focus and perseverance. Reinventing herself. Reinventing her game. @Jaque1212 is #heretocreate.,63k,85,5 years ago
444,https://scontent-waw1-1.cdninstagram.com/v/t51.2885-15/sh0.08/e35/s640x640/12628094_1514840835486723_253404732_n.jpg?_nc_ht=scontent-waw1-1.cdninstagram.com&_nc_cat=103&_nc_ohc=TUDAerL-9W4AX_vhe3h&edm=APU89FABAAAA&ccb=7-4&oh=b08b7c8ee56ef10d09812aeb9257baca&oe=615D9944&_nc_sid=86f79a,What she has is a gold medal in figure skating. What she wants is an identity that’s all her own. @SunnyLipnitskaya is #heretocreate.,79k,200,5 years ago
445,https://scontent-waw1-1.cdninstagram.com/v/t51.2885-15/sh0.08/e35/s640x640/10914281_993647037361142_1209276374_n.jpg?_nc_ht=scontent-waw1-1.cdninstagram.com&_nc_cat=102&_nc_ohc=-hF84h1CW88AX9gNPet&edm=APU89FABAAAA&ccb=7-4&oh=a22cb7afaa661b2e9ec54987dffc8099&oe=615D9E15&_nc_sid=86f79a,You see a wall. She sees an opportunity. @SashaDiGiulian is #heretocreate.,69k,155,5 years ago
446,https://scontent-waw1-1.cdninstagram.com/v/t51.2885-15/sh0.08/e35/s640x640/12628056_1053842048005567_2113520816_n.jpg?_nc_ht=scontent-waw1-1.cdninstagram.com&_nc_cat=107&_nc_ohc=MABZEB8A4hQAX9t4K8p&edm=APU89FABAAAA&ccb=7-4&oh=306a8f987c572bf7da18d89ac5797a81&oe=615C4E55&_nc_sid=86f79a,The love you take is equal to the love you make.,311k,159890,5 years ago
447,https://scontent-waw1-1.cdninstagram.com/v/t51.2885-15/sh0.08/e35/s640x640/12724884_491796364325546_1421569881_n.jpg?_nc_ht=scontent-waw1-1.cdninstagram.com&_nc_cat=102&_nc_ohc=A3SiT5keJY0AX8bnOJ3&edm=APU89FABAAAA&ccb=7-4&oh=13c359168c13dad1b9cb24c579b5c9ac&oe=615CF4ED&_nc_sid=86f79a,The biggest stages in tennis dont come easy. @anaivanovic proves that life is about creating yourself. #heretocreate,75k,297,5 years ago
448,https://scontent-waw1-1.cdninstagram.com/v/t51.2885-15/sh0.08/e35/s640x640/12556068_1696042867305043_1783891391_n.jpg?_nc_ht=scontent-waw1-1.cdninstagram.com&_nc_cat=107&_nc_ohc=vUkXBtr5Mp4AX-wTIWE&edm=APU89FABAAAA&ccb=7-4&oh=e537e860df818c3c6c547d8bc26341c1&oe=615CE9A5&_nc_sid=86f79a,Every day is an opportunity to challenge her identity in the gym and on the runway. @KarlieKloss is #heretocreate.,71k,166,5 years ago
449,https://scontent-waw1-1.cdninstagram.com/v/t51.2885-15/sh0.08/e35/s640x640/12725178_1139323316080561_398859709_n.jpg?_nc_ht=scontent-waw1-1.cdninstagram.com&_nc_cat=101&_nc_ohc=GYf4sZBhFFAAX_X2cyX&edm=APU89FABAAAA&ccb=7-4&oh=0d4dbd3b2adcd497962d58c459a5795c&oe=615D14B3&_nc_sid=86f79a,A fitness artist never stops looking for ways to push the boundaries of sport. @NicoleWinhoffer is #heretocreate.,75k,227,5 years ago
450,https://scontent-waw1-1.cdninstagram.com/v/t51.2885-15/sh0.08/e35/s640x640/12547629_121497698236745_1199169514_n.jpg?_nc_ht=scontent-waw1-1.cdninstagram.com&_nc_cat=105&_nc_ohc=IqplXZgCEXUAX_ifFed&edm=APU89FABAAAA&ccb=7-4&oh=161a783d9fc8e85af3a7c6244fba3794&oe=615E0B1F&_nc_sid=86f79a,"This is Futurecraft.
Cutting-edge craftsmanship for a revolutionary run. Tailored for you, by you.

Introducing Futurecraft Tailored Fibre, a revolutionary manufacturing technique that enables unique footwear designs to be modified to the individual needs of any athlete.",100k,1758,5 years ago
451,https://scontent-waw1-1.cdninstagram.com/v/t51.2885-15/sh0.08/e35/s640x640/12545334_188336448193906_1483226655_n.jpg?_nc_ht=scontent-waw1-1.cdninstagram.com&_nc_cat=110&_nc_ohc=o97uss-sz7MAX9OBg5W&edm=APU89FABAAAA&ccb=7-4&oh=2686eeea07334ecc406e2c4c9743f7d0&oe=615DC785&_nc_sid=86f79a,She’s known for many things. None of them are what you’d expect. @HannahBronfman is #heretocreate.,75k,183,5 years ago
452,https://scontent-waw1-1.cdninstagram.com/v/t51.2885-15/sh0.08/e35/s640x640/12555854_1669004683372190_848175202_n.jpg?_nc_ht=scontent-waw1-1.cdninstagram.com&_nc_cat=102&_nc_ohc=yJxVp5__64EAX9_tzJJ&edm=APU89FABAAAA&ccb=7-4&oh=518d3db6cf8d122077d4deb65412a4a2&oe=615D325E&_nc_sid=86f79a,All-star baller. All-star mother. @CandaceParker is #heretocreate a new meaning for both.,60k,139,5 years ago
453,https://scontent-waw1-1.cdninstagram.com/v/t51.2885-15/sh0.08/e35/s640x640/12628005_1031535700240550_1584403090_n.jpg?_nc_ht=scontent-waw1-1.cdninstagram.com&_nc_cat=102&_nc_ohc=3ybQR2O56m0AX_a2tzr&edm=APU89FABAAAA&ccb=7-4&oh=c14411ef2abb9343b2ad781546ae94bd&oe=615E032B&_nc_sid=86f79a,"Defense wins championships. 
@millerlite40 is your MVP.",91k,211,5 years ago
454,https://scontent-waw1-1.cdninstagram.com/v/t51.2885-15/sh0.08/e35/s640x640/12568344_950002488421092_962834815_n.jpg?_nc_ht=scontent-waw1-1.cdninstagram.com&_nc_cat=100&_nc_ohc=H6kRc-4UjpkAX9o2TPZ&edm=APU89FABAAAA&ccb=7-4&oh=9fb18150b3e4bb05433ba84a3ee27bd3&oe=615C6E49&_nc_sid=86f79a,The gym is wherever she makes it. @RobinNYC is #heretocreate.,78k,80,5 years ago
455,https://scontent-waw1-1.cdninstagram.com/v/t51.2885-15/sh0.08/e35/s640x640/12446179_957265204353156_1949032363_n.jpg?_nc_ht=scontent-waw1-1.cdninstagram.com&_nc_cat=100&_nc_ohc=q4c7uSR6fR0AX9__mLA&edm=APU89FABAAAA&ccb=7-4&oh=17ad9973de53bff6d9e7e6b629b7c2b2&oe=615DED1C&_nc_sid=86f79a,"From the court to the beach, no type of training is off limits. @CaroWozniacki is #heretocreate.",69k,78,5 years ago
456,https://scontent-waw1-1.cdninstagram.com/v/t51.2885-15/sh0.08/e35/s640x640/12568929_648332525304742_158083005_n.jpg?_nc_ht=scontent-waw1-1.cdninstagram.com&_nc_cat=110&_nc_ohc=6K4UVa5ajO4AX9u2_rB&edm=APU89FABAAAA&ccb=7-4&oh=96a2e11c414f855e6d1e87a9d87582a0&oe=615D1F1D&_nc_sid=86f79a,The end of one road is the start of another. Create your own path.,80k,187,5 years ago
457,https://scontent-waw1-1.cdninstagram.com/v/t51.2885-15/sh0.08/e35/s640x640/12292729_175723389445809_1276222459_n.jpg?_nc_ht=scontent-waw1-1.cdninstagram.com&_nc_cat=109&_nc_ohc=LFNjItYCQUkAX87BerD&edm=APU89FABAAAA&ccb=7-4&oh=18079861bce6c1797a877c07993a995c&oe=615D789A&_nc_sid=86f79a,"The speed you want, created as fast as you want it. The SPEEDFACTORY has been activated. Stay tuned.",78k,145,5 years ago
458,https://scontent-waw1-1.cdninstagram.com/v/t51.2885-15/sh0.08/e35/s640x640/12346131_873237032783521_418603922_n.jpg?_nc_ht=scontent-waw1-1.cdninstagram.com&_nc_cat=101&_nc_ohc=Lz5lkh_EIw0AX9md7_n&edm=APU89FABAAAA&ccb=7-4&oh=f978852718b1b1241d8aa2c2a5b121bd&oe=615CE28E&_nc_sid=86f79a,"The tides are turning. 
Futurecraft meets @Parley.tv to transform deep-sea plastic waste into a 3D-printed midsole.​",81k,404,5 years ago
459,https://scontent-waw1-1.cdninstagram.com/v/t51.2885-15/sh0.08/e35/s640x640/12093429_1663700937209533_1119625298_n.jpg?_nc_ht=scontent-waw1-1.cdninstagram.com&_nc_cat=101&_nc_ohc=VtPEv2w7ACMAX-U6rzU&edm=APU89FABAAAA&ccb=7-4&oh=1d63efa847e833d47ab83eec73a85cb4&oe=615D054D&_nc_sid=86f79a,@djokernole takes Paris.,70k,125,5 years ago
460,https://scontent-waw1-1.cdninstagram.com/v/t51.2885-15/sh0.08/e35/s640x640/1169926_1477800105861960_1201837235_n.jpg?_nc_ht=scontent-waw1-1.cdninstagram.com&_nc_cat=100&_nc_ohc=bVFAuf_-jt4AX_wnWAM&edm=APU89FABAAAA&ccb=7-4&oh=735afd0479e81fc692f5b4e9adedd1cf&oe=615DAC16&_nc_sid=86f79a,Redefine routine. The city is your studio.,71k,109,5 years ago
461,https://scontent-waw1-1.cdninstagram.com/v/t51.2885-15/sh0.08/e35/s640x640/11939515_140727892949295_2137355549_n.jpg?_nc_ht=scontent-waw1-1.cdninstagram.com&_nc_cat=103&_nc_ohc=QAsjW32yQokAX_Y_Ges&edm=APU89FABAAAA&ccb=7-4&oh=50cf237f1a77354884af48d07e7d17f0&oe=615C72EE&_nc_sid=86f79a,Suit up and show your stripes. Today we celebrate adidas Tracksuit Day.,89k,681,5 years ago
462,https://scontent-waw1-1.cdninstagram.com/v/t51.2885-15/e35/12142213_1515633442080656_125361104_n.jpg?_nc_ht=scontent-waw1-1.cdninstagram.com&_nc_cat=108&_nc_ohc=ttYBl1cQFV4AX_P-rlj&edm=APU89FABAAAA&ccb=7-4&oh=785880c5e3cc1e75b93fa3c8bec64e47&oe=615DA942&_nc_sid=86f79a,History made. Back to black.,85k,235,5 years ago
463,https://scontent-waw1-1.cdninstagram.com/v/t51.2885-15/sh0.08/e35/p640x640/12144291_1656950534553358_1121024630_n.jpg?_nc_ht=scontent-waw1-1.cdninstagram.com&_nc_cat=110&_nc_ohc=7elISLd0HgoAX-1iYnL&edm=APU89FABAAAA&ccb=7-4&oh=0cf501b829f93d79132331806216d0f0&oe=615C66C5&_nc_sid=86f79a,Limitless style for the bold. @adidasOriginals x Kanye West YEEZY SEASON 1 available worldwide tomorrow.,67k,611,5 years ago
464,https://scontent-waw1-1.cdninstagram.com/v/t51.2885-15/sh0.08/e35/s640x640/12145609_1034426919935222_300226451_n.jpg?_nc_ht=scontent-waw1-1.cdninstagram.com&_nc_cat=102&_nc_ohc=CWFisw1BfhoAX_V1s8A&edm=APU89FABAAAA&ccb=7-4&oh=cbbb6f0ff4564482ee736e0623f9300e&oe=615D6257&_nc_sid=86f79a,Tomorrows destiny is todays hard work. Take Today.,79k,147,5 years ago
465,https://scontent-waw1-1.cdninstagram.com/v/t51.2885-15/sh0.08/e35/s640x640/12139864_749399935165053_1466238738_n.jpg?_nc_ht=scontent-waw1-1.cdninstagram.com&_nc_cat=109&_nc_ohc=7zZYTV-yFoUAX8O8-Zc&edm=APU89FABAAAA&ccb=7-4&oh=96bab6fbef6e3e7c6a4cb9f1468046dc&oe=615DA744&_nc_sid=86f79a,Make a move or move out of the way. Its forever or never.,67k,201,5 years ago
466,https://scontent-waw1-1.cdninstagram.com/v/t51.2885-15/e35/12139815_1638528003097303_242298706_n.jpg?_nc_ht=scontent-waw1-1.cdninstagram.com&_nc_cat=107&_nc_ohc=3UYtbmenE-4AX8NwMh4&edm=APU89FABAAAA&ccb=7-4&oh=46cd297f90fd95c13248ed8ee177501f&oe=615D06B0&_nc_sid=86f79a,No limits. Rise above and let the Superstar in you shine.,67k,157,5 years ago
467,https://scontent-waw1-1.cdninstagram.com/v/t51.2885-15/sh0.08/e35/s640x640/11849232_484634241742668_1649913617_n.jpg?_nc_ht=scontent-waw1-1.cdninstagram.com&_nc_cat=100&_nc_ohc=xkAMwqDrbOkAX-pLaIk&edm=APU89FABAAAA&ccb=7-4&oh=208a3b322ab6979c669603d350e843b0&oe=615DF2C9&_nc_sid=86f79a,Your dream. Your freedom. Claim it.,84k,274,5 years ago
468,https://scontent-waw1-1.cdninstagram.com/v/t51.2885-15/sh0.08/e35/s640x640/12144079_1714913228741784_461435489_n.jpg?_nc_ht=scontent-waw1-1.cdninstagram.com&_nc_cat=100&_nc_ohc=fl5tP_BGwVcAX9ctz00&edm=APU89FABAAAA&ccb=7-4&oh=dd93ba1fa4862fa08aee881681969028&oe=615DB0FB&_nc_sid=86f79a,Absolute focus. Undeniable strength.,78k,303,5 years ago
469,https://scontent-waw1-1.cdninstagram.com/v/t51.2885-15/sh0.08/e35/s640x640/12145103_517826118376163_1338324917_n.jpg?_nc_ht=scontent-waw1-1.cdninstagram.com&_nc_cat=111&_nc_ohc=aGRj78_ir0oAX9E3Q7z&edm=APU89FABAAAA&ccb=7-4&oh=8216146097da51711cfb85e7a0c5cce3&oe=615D0CBB&_nc_sid=86f79a,"Today we run Chicago. 
Prove yourself and attack the city.",94k,159,5 years ago
470,https://scontent-waw1-1.cdninstagram.com/v/t51.2885-15/sh0.08/e35/s640x640/12145368_498539543657362_762948690_n.jpg?_nc_ht=scontent-waw1-1.cdninstagram.com&_nc_cat=110&_nc_ohc=7S2I43rJ0fgAX8WDHwl&edm=APU89FABAAAA&ccb=7-4&oh=c49df1414798523dc31aef52c1df7fef&oe=615C56B7&_nc_sid=86f79a,"An icon, a legend, a gentleman. Today, Ma‘a Nonu celebrates his 100th cap. We‘re proud to play with the best.",87k,209,5 years ago
471,https://scontent-waw1-1.cdninstagram.com/v/t51.2885-15/sh0.08/e35/s640x640/12105139_1723710337862005_2103282776_n.jpg?_nc_ht=scontent-waw1-1.cdninstagram.com&_nc_cat=101&_nc_ohc=WeqpgZenu7UAX_XUtXk&edm=APU89FABAAAA&ccb=7-4&oh=ef66808228c73afcbc980c53356143ed&oe=615CFF5C&_nc_sid=86f79a,3D-printed performance footwear. This is Futurecraft 3D. Take a sneak peek at the future of running.,94k,1601,5 years ago
472,https://scontent-waw1-1.cdninstagram.com/v/t51.2885-15/sh0.08/e35/s640x640/12120478_148312282186811_1758141619_n.jpg?_nc_ht=scontent-waw1-1.cdninstagram.com&_nc_cat=111&_nc_ohc=i8Hiql7tfsAAX8Ubic2&edm=APU89FABAAAA&ccb=7-4&oh=1d403a988d5d89310655fb09104d3fd2&oe=615C5C09&_nc_sid=86f79a,Find your balance.,99k,456,5 years ago
473,https://scontent-waw1-1.cdninstagram.com/v/t51.2885-15/sh0.08/e35/p640x640/12063089_1500478510278108_2047615098_n.jpg?_nc_ht=scontent-waw1-1.cdninstagram.com&_nc_cat=100&_nc_ohc=nlJ8bGrnVdwAX-qN92Q&edm=APU89FABAAAA&ccb=7-4&oh=4b66cdfef3d79f18c387979d6eea7604&oe=615D87EC&_nc_sid=86f79a,"The wait is over. Welcome, @JHarden13.",90k,573,5 years ago
474,https://scontent-waw1-1.cdninstagram.com/v/t51.2885-15/sh0.08/e35/p640x640/11420925_189381731394025_1236720642_n.jpg?_nc_ht=scontent-waw1-1.cdninstagram.com&_nc_cat=101&_nc_ohc=c6zHvT56730AX9yiHnf&edm=APU89FABAAAA&ccb=7-4&oh=7d19a8595ba5519357de66b9ec9c49bb&oe=615CCFB8&_nc_sid=86f79a,"Without sweat, there is no victory. Look up to the stars; its forever or never.",97k,192,6 years ago
475,https://scontent-waw1-1.cdninstagram.com/v/t51.2885-15/sh0.08/e35/s640x640/11909355_482150261946248_1867831547_n.jpg?_nc_ht=scontent-waw1-1.cdninstagram.com&_nc_cat=108&_nc_ohc=vDh6GIsL0hkAX_fn-xG&edm=APU89FABAAAA&ccb=7-4&oh=3d9230417a8a658bcdc0fdd3de0850a1&oe=615C6681&_nc_sid=86f79a,"Today was a good Day. 
Jason Day, world number one. 1⃣",57k,92,6 years ago
476,https://scontent-waw1-1.cdninstagram.com/v/t51.2885-15/sh0.08/e35/p640x640/11887256_505566042950880_1761422716_n.jpg?_nc_ht=scontent-waw1-1.cdninstagram.com&_nc_cat=100&_nc_ohc=55lczfyjziMAX_SxFiR&edm=APU89FABAAAA&ccb=7-4&oh=d73d23564ab4402178b3ae7dd434e832&oe=615DE12B&_nc_sid=86f79a,Kanye West and @adidasoriginals: A preview of whats to come... #YEEZYBOOST #adidasOriginals,80k,844,6 years ago
477,https://scontent-waw1-1.cdninstagram.com/v/t51.2885-15/sh0.08/e35/s640x640/11931045_1472392996400685_1650299685_n.jpg?_nc_ht=scontent-waw1-1.cdninstagram.com&_nc_cat=109&_nc_ohc=QniMykIXQUwAX_fQeeM&edm=APU89FABAAAA&ccb=7-4&oh=e9f675e80beb82d3ece9234264766fc2&oe=615C90B7&_nc_sid=86f79a,"Today adidas long-term partner Kanye West presented a collection as a designer in his own right.

By including the #YEEZYBOOST and Ultraboost, Kanye gives an exclusive preview of what’s to come. 
Congratulations, Mr. West!",74k,1064,6 years ago
478,https://scontent-waw1-1.cdninstagram.com/v/t51.2885-15/sh0.08/e35/s640x640/11821954_911151568955145_822219543_n.jpg?_nc_ht=scontent-waw1-1.cdninstagram.com&_nc_cat=109&_nc_ohc=LAbwRkJjXr0AX_1AcC-&edm=APU89FABAAAA&ccb=7-4&oh=509027f5ed84535a730b51af04baed8f&oe=615DC57D&_nc_sid=86f79a,A true champion from the ground up.,92k,401,6 years ago
479,https://scontent-waw1-1.cdninstagram.com/v/t51.2885-15/sh0.08/e35/s640x640/11917737_1478963745740919_731517727_n.jpg?_nc_ht=scontent-waw1-1.cdninstagram.com&_nc_cat=103&_nc_ohc=qsUG8wpCHKkAX_O1JsN&edm=APU89FABAAAA&ccb=7-4&oh=0f9ab63049386c3df4d4cb04243b3cdd&oe=615DC575&_nc_sid=86f79a,From your first serve to your final victory. Leave your mark on the game.,72k,103,6 years ago
480,https://instagram.flwo4-1.fna.fbcdn.net/v/t51.2885-15/sh0.08/e35/s640x640/11849330_988643631178906_1594044833_n.jpg?_nc_ht=instagram.flwo4-1.fna.fbcdn.net&_nc_cat=110&_nc_ohc=0uZhYuG9KzEAX_6I0Kr&edm=APU89FABAAAA&ccb=7-4&oh=2697db5aba34038a10991628b1013506&oe=615CCAA8&_nc_sid=86f79a,Seize the moment when they least expect it. @flaviapennetta_ is the 2015 U.S. Open champion.,77k,190,6 years ago
481,https://instagram.flwo4-2.fna.fbcdn.net/v/t51.2885-15/sh0.08/e35/s640x640/11327363_1487593024868576_279353612_n.jpg?_nc_ht=instagram.flwo4-2.fna.fbcdn.net&_nc_cat=108&_nc_ohc=OSHXV8tDYlsAX9pCrwK&edm=APU89FABAAAA&ccb=7-4&oh=23e97d3bfd96eaf135820a8b9630fb43&oe=615CF8B0&_nc_sid=86f79a,Records belong in the history books. Next year is all that matters.,86k,177,6 years ago
